{
  "release_id": "2026-10-07-061436ccd3b9",
  "artifact_schema_version": "1.0",
  "shard": "05",
  "pages": {
    "bend-method-enformer": {
      "route_kind": "configuration",
      "record_id": "bend-method-enformer",
      "canonical_route": "/database/configuration/bend-method-enformer/",
      "record": {
        "id": "bend-method-enformer",
        "kind": "configuration",
        "name": "ENFORMER",
        "description": "Specialist published model that the BEND authors compare against on this task, not a language model embedding.",
        "status": "source_checked",
        "facets": {
          "areas": [
            "dna-genomes"
          ]
        },
        "source_ids": [
          "evidence-expansion-bend-final-f709b6be"
        ],
        "links": [],
        "attributes": {
          "source_locator": "Table 3, row(Expert method), column(Enhancer annotation)",
          "missing_metadata": {
            "checkpoint_revision": "unreported",
            "parameters": "unextracted"
          }
        }
      },
      "direct": [],
      "reverse": [
        {
          "relation": "model",
          "id": "bend-evaluation-enformer-enhancer"
        }
      ],
      "source_ids": [
        "evidence-expansion-bend-final-f709b6be"
      ],
      "summary": {
        "results": 1,
        "evaluations": 1,
        "evidence_rows": 10,
        "published_comparisons": 0,
        "use_case_links": 0
      },
      "sections": {
        "results": {
          "items": [
            {
              "result": {
                "id": "bend-result-enformer-enhancer-auprc",
                "kind": "result",
                "name": "ENFORMER · BEND ENHANCER · AUPRC",
                "description": "Author-reported score transcribed from the paper's comparison table. Source checked; not independently reproduced.",
                "status": "source_checked",
                "facets": {
                  "areas": [
                    "dna-genomes"
                  ],
                  "tasks": [
                    "Enhancer annotation"
                  ]
                },
                "source_ids": [
                  "evidence-expansion-bend-final-f709b6be"
                ],
                "links": [
                  {
                    "relation": "evaluation",
                    "target_id": "bend-evaluation-enformer-enhancer"
                  }
                ],
                "attributes": {
                  "metric": "auprc",
                  "metric_direction": "higher",
                  "unit": "fraction",
                  "printed_value": "0.07",
                  "numeric_value": "0.07",
                  "uncertainty": null,
                  "source_locator": "Table 3, row(Expert method), column(Enhancer annotation)",
                  "missing_metadata": {
                    "denominator": "unextracted",
                    "seeds": "unreported"
                  },
                  "review": {
                    "method": "Deterministic parse of the pinned PDF text layer, with row and column counts asserted",
                    "reviewer": "Codex research agent; no human review claimed",
                    "date": "2026-09-18",
                    "artifact_sha256": "f709b6bef3120eb979c0a0e02d2582475c49410f29850ed7601ba7a700ca379d",
                    "retrieval_url": "https://proceedings.iclr.cc/paper_files/paper/2024/file/429e7b31625a8b7839f9e4d6e2aa9bb9-Paper-Conference.pdf",
                    "notes": "Source checked, not reproduced. Metrics differ by task, so no composite score across tasks is computed or implied."
                  }
                }
              },
              "evaluation_id": "bend-evaluation-enformer-enhancer",
              "origin": "author_reported",
              "review_status": "source_checked",
              "links": {
                "models": [
                  "bend-method-enformer"
                ],
                "benchmarks": [
                  "bend-task-enhancer"
                ],
                "methods": [],
                "configurations": [
                  "bend-method-enformer"
                ],
                "pipelines": [],
                "services": [],
                "tasks": [
                  "bend-task-enhancer"
                ],
                "protocols": [],
                "evaluators": [],
                "datasets": [
                  "bend-dataset-fulco-2019-gasperini-2019-and-enformer-enhancer-set"
                ],
                "dataset_subsets": [
                  "bend-dataset-fulco-2019-gasperini-2019-and-enformer-enhancer-set"
                ],
                "sources": [
                  "evidence-expansion-bend-final-f709b6be"
                ]
              }
            }
          ],
          "total": 1,
          "limit": 25,
          "next_cursor": null
        },
        "evaluations": {
          "bend-evaluation-enformer-enhancer": {
            "id": "bend-evaluation-enformer-enhancer",
            "kind": "evaluation",
            "name": "ENFORMER on BEND ENHANCER: Enhancer annotation",
            "description": "BEND evaluation of ENFORMER on Enhancer annotation, scored with AUPRC.",
            "status": "source_checked",
            "facets": {
              "areas": [
                "dna-genomes"
              ],
              "tasks": [
                "Enhancer annotation"
              ]
            },
            "source_ids": [
              "evidence-expansion-bend-final-f709b6be"
            ],
            "links": [
              {
                "relation": "benchmark",
                "target_id": "bend-task-enhancer"
              },
              {
                "relation": "model",
                "target_id": "bend-method-enformer"
              },
              {
                "relation": "dataset",
                "target_id": "bend-dataset-fulco-2019-gasperini-2019-and-enformer-enhancer-set"
              }
            ],
            "attributes": {
              "origin": "author_reported",
              "protocol": "A downstream head trained on frozen embeddings, except for the expert methods and the fully supervised baselines, which are trained end to end. Metric and splits are from Table 1.",
              "comparison": {
                "protocol_id": "bend-task-enhancer",
                "metric_implementation": "AUPRC"
              },
              "missing_metadata": {
                "checkpoint_revision": "unreported",
                "seeds": "unreported",
                "budget": "unreported",
                "split_manifest": "unextracted"
              },
              "source_locator": "Table 3, row(Expert method), column(Enhancer annotation)"
            }
          }
        },
        "evidence": {
          "items": [
            {
              "row_id": "bend-method-enformer:attributes.missing_metadata.checkpoint_revision::",
              "release_id": "2026-10-07-061436ccd3b9",
              "record_id": "bend-method-enformer",
              "record_kind": "configuration",
              "record_name": "ENFORMER",
              "field_path": "attributes.missing_metadata.checkpoint_revision",
              "property": "attributes.missing_metadata.checkpoint_revision",
              "value": "unreported",
              "value_json": "\"unreported\"",
              "evidence_scope": "catalogue_metadata",
              "review_status": "catalogued",
              "record_status": "source_checked",
              "evidence_origin": "",
              "claim_id": "",
              "claimed_value_json": "",
              "claim_record_status": "",
              "source_id": "",
              "source_title": "",
              "source_url": "",
              "source_doi": "",
              "source_version": "",
              "source_locator": "",
              "artifact_url": "",
              "artifact_sha256": "",
              "hash_scope": "Hash scope not separately documented; inspect source record",
              "artifact_format": "",
              "artifact_member": "",
              "locator_scope": "single_source_locator",
              "source_concerns": "",
              "retrieved_at": "",
              "review_method": "",
              "review_date": "",
              "review_note": "",
              "extraction_artifact_url": "",
              "extraction_artifact_sha256": ""
            },
            {
              "row_id": "bend-method-enformer:attributes.missing_metadata.parameters::",
              "release_id": "2026-10-07-061436ccd3b9",
              "record_id": "bend-method-enformer",
              "record_kind": "configuration",
              "record_name": "ENFORMER",
              "field_path": "attributes.missing_metadata.parameters",
              "property": "attributes.missing_metadata.parameters",
              "value": "unextracted",
              "value_json": "\"unextracted\"",
              "evidence_scope": "catalogue_metadata",
              "review_status": "catalogued",
              "record_status": "source_checked",
              "evidence_origin": "",
              "claim_id": "",
              "claimed_value_json": "",
              "claim_record_status": "",
              "source_id": "",
              "source_title": "",
              "source_url": "",
              "source_doi": "",
              "source_version": "",
              "source_locator": "",
              "artifact_url": "",
              "artifact_sha256": "",
              "hash_scope": "Hash scope not separately documented; inspect source record",
              "artifact_format": "",
              "artifact_member": "",
              "locator_scope": "single_source_locator",
              "source_concerns": "",
              "retrieved_at": "",
              "review_method": "",
              "review_date": "",
              "review_note": "",
              "extraction_artifact_url": "",